标题,卖点,总价,单价,户型,楼层,共有楼层数,装修,朝向,建造时间,面积,小区,区域,所属区,梯户比例,是否有电梯,房屋属性,详情页
豪气装修4房，带车位，可拎包入住,此房装修保养的很好，正规的4房，户型周正，楼层好，诚心出售,155,12684,4室2厅,中楼层,29,精装,南,2015,122.21,欧莱雅郡,汽车南站,雨花,一梯四户,暂无数据,商品房,https://cs.lianjia.com/ershoufang/104108670907.html
欧莱雅郡别墅区高层 91平3房 户型好环境好视野无遮挡,此房已经随时交易 格局好，楼层好，装修保养好可拎包入住,102,11227,3室2厅,高楼层,33,精装,南,2013,90.86,欧莱雅郡,汽车南站,雨花,两梯四户,有,商品房,https://cs.lianjia.com/ershoufang/104108697221.html
麓谷三房户型周正，朝南户型精装修，带中.央空调,此房户型周正，朝南户型精装修，带中.央空调,96,10634,3室2厅,中楼层,11,精装,南,2009,90.28,远大麓园,麓谷东,岳麓,两梯四户,有,商品房,https://cs.lianjia.com/ershoufang/104108683841.html
精装2房，户型周正。满五唯一 。交通方便。,动静分离，满五唯一。精装2房，交通便利。生活配套方便。,116,13230,2室2厅,高楼层,27,精装,南 北,2015,87.68,富兴汇中央,铁道学院,天心,两梯四户,有,商品房,https://cs.lianjia.com/ershoufang/104108718988.html
业主诚心出售、出行便利的房子，出门地铁口、居家精装,业主诚心出售、出行便利的房子，出门地铁口、居家精装,91.8,10341,3室2厅,高楼层,34,精装,南,0,88.78,华润置地广场一期,开元路,长沙县,两梯六户,有,商品房,https://cs.lianjia.com/ershoufang/104108717006.html
急售刚需三房，拎包入住，树木岭百万大社区,此房满五唯一，次新小区，配套齐全,78,10169,3室1厅,高楼层,33,精装,西北,2013,76.69,兰亭小时代,树木岭,雨花,两梯七户,有,商品房,https://cs.lianjia.com/ershoufang/104108709091.html
宜居莱茵城 3室2厅 南,链家网真房源，更多房源信息请联系经纪人,142.5,11172,3室2厅,高楼层,32,精装,南,2010,127.56,宜居莱茵城,河西人人乐,岳麓,两梯三户,有,商品房,https://cs.lianjia.com/ershoufang/104108699385.html
万科里梅溪湖精装三房，配套优质，品质小区,配套齐全，中间楼层，房东诚心出售！房间全明！,216,22170,3室2厅,中楼层,22,精装,南,0,97.43,万科里梅溪郡,岳麓其他,岳麓,两梯五户,有,商品房,https://cs.lianjia.com/ershoufang/104108695955.html
百纳公寓 3室2厅 南 北,链家网真房源，更多房源信息请联系经纪人,108,11905,3室2厅,低楼层,33,其他,南 北,2013,90.72,百纳公寓,马王堆,芙蓉,两梯五户,有,商品房,https://cs.lianjia.com/ershoufang/104108682806.html
地铁口 学林西岸 房东诚心出售,，地铁口400米 ，房东诚心出售,128.8,9685,5室2厅,中楼层,30,精装,南 北,2013,133,学林西岸,金星北,望城,两梯四户,有,商品房,https://cs.lianjia.com/ershoufang/104108670908.html
开元路 松雅湖 地铁口 恒基凯旋门 精装电梯三房出售,闲置房产出售，楼层好，采光好，户型方正，配套成熟,115,11014,3室2厅,中楼层,18,精装,东南 南,2013,104.42,恒基凯旋门,开元路,长沙县,两梯五户,有,商品房,https://cs.lianjia.com/ershoufang/104108715205.html
蓝山郡一期 三号线正地铁口  全明朝南 视野好,优质小区，刚需户型，绿化高，配套齐全，居住舒适,118.8,9717,3室2厅,中楼层,33,精装,南,0,122.27,蓝山郡一期,开元路,长沙县,两梯六户,有,商品房,https://cs.lianjia.com/ershoufang/104108712284.html
业主诚售 精装两房 视野开阔 居住舒适,此房业主自住精装修 保养好 中间楼层 视野采光好,62.8,6615,2室2厅,中楼层,16,精装,东南,2011,94.95,博雅湘水湾,泉塘,长沙县,两梯四户,有,商品房,https://cs.lianjia.com/ershoufang/104108696251.html
店长推荐，梅溪湖 、精装二房  一梯二户 低密度,此房为精致两房，视野宽阔，采光好，一梯两户,68,7887,2室2厅,低楼层,6,精装,南,2005,86.22,山水英伦庄园,雷锋镇,岳麓,一梯两户,无,商品房,https://cs.lianjia.com/ershoufang/104108720707.html
价格实惠，中间楼层，诚心出售，户型周正带两卫,价格实惠，中间楼层，诚心出售，户型周正带两卫,96.8,8787,2室2厅,中楼层,18,精装,南,2007,110.17,佳阳悦景馨都,四方坪,开福,两梯五户,有,商品房,https://cs.lianjia.com/ershoufang/104108666301.html
南北通，格局好 视野采光好 诚心出售成熟配套,南北通，格局好 视野采光好 诚心出售，成熟配套,85,8228,3室2厅,低楼层,11,精装,南 北,2009,103.31,湘林小区,铁道学院,天心,一梯两户,有,经济适用房,https://cs.lianjia.com/ershoufang/104108699276.html
中信广场地铁 青园中信小雪  湘雅医院 没有个税,中信广场地铁 青园中信小雪  湘雅医院 没有个税,65,8442,2室2厅,低楼层,11,精装,南,2014,77,中信文化广场雅居,暮云,天心,一梯四户,有,商品房,https://cs.lianjia.com/ershoufang/104108689946.html
华润万象城旁 六沟垅地铁口 大三房低总价 满五 唯一,华润万象城旁六沟垅地铁口 大三房低总价 满五 唯一,115,9045,3室2厅,高楼层,16,简装,南 北,2007,127.15,湘许嘉园一期,银盆岭,岳麓,两梯四户,有,商品房,https://cs.lianjia.com/ershoufang/104108669211.html
湘江边 香江锦城  正规三房 正地铁站  开福寺 临湘雅,户型周正 位置佳 诚意出售 价格实惠 地铁站旁 临湘雅,130,14509,3室2厅,低楼层,33,简装,南,2012,89.6,香江锦城,伍家岭,开福,两梯五户,有,商品房,https://cs.lianjia.com/ershoufang/104108694721.html
潇湘奥林匹克花园 滨海园林 人车分流 科技产业园,交通便利，楼层号视眼开阔，采光充足，配套设施齐全,120,11272,3室2厅,中楼层,32,其他,南 北,2016,106.46,潇湘奥林匹克花园,麓谷西,岳麓,两梯四户,有,商品房,https://cs.lianjia.com/ershoufang/104108684846.html
雨花区神复式  精装房 拎包入住,枫树山一路之隔，楼层好、视野开阔，朝南户型，带车位，精装修,115,11735,4室2厅,低楼层,34,精装,北,0,98,中航城,万家丽南路,雨花,三梯十二户,有,商品房,https://cs.lianjia.com/ershoufang/104108700847.html
都市兰亭二房精装 房东自住装修 新,小约建筑年代新，装修好，楼层好，户型好，交通方便.看房方便,72.8,11301,2室2厅,低楼层,32,精装,南,2013,64.42,都市兰亭汇峰苑,雨花亭,雨花,三梯六户,有,商品房,https://cs.lianjia.com/ershoufang/104108708426.html
小区离地铁近，房子精装修，满五唯一，房东急售,小区离地铁近，房子精装修，满五唯一，房东急售,78.8,9163,3室2厅,中楼层,26,精装,南,2013,86,学林西岸,金星北,望城,两梯四户,有,商品房,https://cs.lianjia.com/ershoufang/104108702076.html
房东急售 卓越浅水湾 中高楼层 周南梅溪湖 视野开阔,小区有幼儿园，周南梅溪湖，开发商自带物业，环境优美,165,15473,3室1厅,高楼层,44,精装,南,2017,106.64,卓越浅水湾,梅溪湖南岸,岳麓,三梯四户,有,商品房,https://cs.lianjia.com/ershoufang/104108675310.html
地铁500米 精装带暖气片 满5唯一 中间楼层 视野好,精装，带家具家电 满5唯一 带暖气片 楼层高 视野好 能看湖,115.5,9873,3室2厅,中楼层,35,精装,南 北,2015,116.99,时代倾城,金星北,望城,两梯四户,有,商品房,https://cs.lianjia.com/ershoufang/104108689444.html
房东诚心急售 芙蓉广场 韭菜园新富城小区大四房没公摊,此房房东诚心急售 户型周正 楼层居中 紧挨地铁口 出行方便,108,8210,4室2厅,低楼层,8,简装,南 北,0,131.56,新富城,浏城桥,芙蓉,一梯四户,有,商品房,https://cs.lianjia.com/ershoufang/104108664220.html
品质次新小区，人车风流，环境好临公园,品质小区 居家装修 保养好，小区人车风流，近公园。采光视,110,8713,3室2厅,高楼层,34,精装,南,2012,126.26,三一街区,万家丽北,长沙县,两梯四户,有,商品房,https://cs.lianjia.com/ershoufang/104108703743.html
梅溪湖金茂悦，地铁口，自住装修,地铁口，配套成熟，房龄新，品质小区，户型周正,203,17662,3室2厅,中楼层,32,精装,南,2015,114.94,金茂悦,梅溪湖北岸,岳麓,两梯四户,有,商品房,https://cs.lianjia.com/ershoufang/104108705156.html
地铁口，几年前的自住精装修，9成新拎包入住，物业好,公务员小区，地铁口，几年前的自住精装修，9成新拎包入住,132,10684,3室2厅,中楼层,7,精装,南 北,0,123.55,惠泽园,马王堆,芙蓉,一梯两户,无,商品房,https://cs.lianjia.com/ershoufang/104108681533.html
7天必售 市政府 居家装修 满五唯一 次新小区,7天必售 市政府 居家装修 满五唯一 次新小区,148,12609,3室2厅,低楼层,33,精装,南,0,117.38,奥克斯缔壹城,雷锋大道,岳麓,一梯四户,暂无数据,商品房,https://cs.lianjia.com/ershoufang/104108684837.html
和泉嘉园优质小三房 婚房装饰 拎包入住,产权清晰，装修8成新，诚心出售,76.8,8432,3室2厅,中楼层,31,精装,南,0,91.09,和泉嘉园,泉塘,长沙县,两梯四户,有,商品房,https://cs.lianjia.com/ershoufang/104108687343.html
全屋定制精装35万 从未入住过 可拎包入住采光好,全屋定制精装35万 从未入住过 可拎包入住采光好,132.8,15105,3室1厅,中楼层,33,精装,南,2013,87.92,万科城市花园,梅溪湖北岸,岳麓,两梯四户,有,商品房,https://cs.lianjia.com/ershoufang/104108665340.html
西站近地铁口花园式小区精装两房，家电齐全拎包入住,此房满五唯一，格局好，健康楼层，视野开阔，采光充...,68,7827,2室2厅,高楼层,6,精装,南,2000,86.88,阳明山庄,麓谷东,岳麓,一梯两户,无,商品房,https://cs.lianjia.com/ershoufang/104108724062.html
房子满五唯一，河景精装4房，楼层好,精装修，拎包入住，河景房，看房方便诚心出售,162,12384,4室2厅,高楼层,34,精装,南 北 东,2011,130.82,鑫科明珠,马王堆,芙蓉,两梯四户,有,商品房,https://cs.lianjia.com/ershoufang/104108677011.html
万科品质小区，地铁口，业主自住装修保养好，圭塘河畔,正南向视野好，业主自住的，保养很好,132.8,13921,3室2厅,低楼层,30,精装,南,2014,95.4,万科金域华府,武广新城,雨花,两梯四户,有,商品房,https://cs.lianjia.com/ershoufang/104108664028.html
钰龙天下一期，自住精装四房，南北对流，正对操场,自住精装修，南北对流，宽敞舒适，视野开阔，可以看操场,360,24053,4室1厅,高楼层,36,其他,东南,0,149.67,钰龙天下,观沙岭,岳麓,两梯四户,有,商品房,https://cs.lianjia.com/ershoufang/104108697320.html
房子业主自住，居家装修，户型周正！,此房格局好，楼层适中，采光好。户型周正，房东诚心,86,7232,3室1厅,中楼层,33,精装,南,2011,118.93,尚都花园城,泉塘,长沙县,两梯四户,有,商品房,https://cs.lianjia.com/ershoufang/104107275960.html
开福北地铁口双湾国际一线江景房,"1.此房源可以看江，视野开阔。
2.户型周正小三房
3.房东诚心..",123,11776,3室2厅,高楼层,31,毛坯,南,2014,104.45,双湾国际,金霞,开福,两梯四户,有,商品房,https://cs.lianjia.com/ershoufang/104107650144.html
电梯小高层两梯两户纯板楼 出门有地铁 南北通透大三房,电梯小高层两梯两户纯板楼 出门有地铁 南北通透大三房,143,10918,3室2厅,低楼层,18,精装,南 北,2009,130.98,西岸润泽府,桐梓坡,岳麓,两梯两户,有,商品房,https://cs.lianjia.com/ershoufang/104107978207.html
精装修带全套家电拎包入住，新中式风格 四房 双阳台,精装修带全套家电拎包入住，新中式风格 四房 双阳台,270,18778,4室2厅,高楼层,40,精装,南,0,143.79,北辰三角洲E6区,北辰三角洲,开福,两梯四户,有,商品房,https://cs.lianjia.com/ershoufang/104107610767.html
保利天禧 天花板中板 看江看橘子洲看烟花 一线江景房,此房一线江景大平层，客厅看橘子洲头烟花,638,31931,4室2厅,中楼层,52,毛坯,南 北,0,199.81,保利天禧,银盆岭,岳麓,三梯一户,有,商品房,https://cs.lianjia.com/ershoufang/104108719954.html
品质万科城，自住装修，空房，业主诚售。,品质万科城，自住装修，空房，业主诚售。,118,13112,3室2厅,低楼层,34,精装,南,2014,90,万科城二期B区,福元西路,开福,两梯五户,有,商品房,https://cs.lianjia.com/ershoufang/104108724815.html
新天小区 楼层  4楼  户型周正 看房方便,户型周正、公摊小、看房方便、业主诚心出售,86.8,7964,3室1厅,中楼层,7,精装,南,2000,109,新天小区,新开铺,天心,一梯两户,无,商品房,https://cs.lianjia.com/ershoufang/104108731007.html
湘熙水郡 3室1厅 南,链家网真房源，更多房源信息请联系经纪人,129,13981,3室1厅,高楼层,29,精装,南,2014,92.27,湘熙水郡,洋湖垸,岳麓,两梯四户,有,商品房,https://cs.lianjia.com/ershoufang/104108713919.html
群芳园 2室1厅 南,链家网真房源，更多房源信息请联系经纪人,69,8334,2室1厅,中楼层,8,简装,南,1994,82.8,群芳园,伍家岭,开福,一梯两户,无,商品房,https://cs.lianjia.com/ershoufang/104108737276.html
高鑫麓城北欧风精装三房，户型周正采光好，近地铁,高鑫麓城北欧精装三房，户型周正采光好，近地铁,134,15353,3室2厅,低楼层,29,精装,东南,2012,87.27,高鑫麓城,商学院,岳麓,两梯四户,有,商品房,https://cs.lianjia.com/ershoufang/104108715274.html
地铁口 山水湾WS区便宜的三房 视野采光好 人车分流,地铁口 山水湾WS区便宜的三房 视野采光好 人车分流,69.8,7395,3室2厅,高楼层,33,毛坯,南,2015,94.4,山水湾,万家丽北,长沙县,两梯四户,有,商品房,https://cs.lianjia.com/ershoufang/104108712769.html
南北双阳台，采光好，精装修，拎包入住，,南北双阳台，采光好，精装修，拎包入住，！,159.8,12016,3室2厅,中楼层,11,精装,南,2013,133,茂华国际湘,武广新城,雨花,两梯两户,有,商品房,https://cs.lianjia.com/ershoufang/104108712958.html
湘江世纪城南边苑，居家精装三房两厅两卫，,南北通透双阳台，户型周正，没有浪费面积，完全人车分流,160,12837,3室2厅,低楼层,33,精装,南 北,2009,124.64,世纪城咏江苑,湘江世纪城,开福,两梯两户,有,商品房,https://cs.lianjia.com/ershoufang/104108713737.html
湘江世纪城南边苑，居家精装三房两厅两卫，,南北通透双阳台，户型周正，没有浪费面积，完全人车分流,160,12837,3室2厅,低楼层,33,精装,南 北,2009,124.64,世纪城咏江苑,湘江世纪城,开福,两梯两户,有,商品房,https://cs.lianjia.com/ershoufang/104108713737.html
中建芙蓉嘉苑 3室2厅 东南,链家网真房源，更多房源信息请联系经纪人,146,13003,3室2厅,中楼层,17,毛坯,东南,0,112.29,中建芙蓉嘉苑,省政府,天心,一梯四户,暂无数据,商品房,https://cs.lianjia.com/ershoufang/104108737998.html
蓉广场，八一桥，电梯大4房，单价9字头，中间楼层,蓉广场，八一桥，电梯大4房，单价9字头，中间楼层,148.8,9987,4室2厅,中楼层,20,精装,南,0,149,银海大厦,松桂园,开福,两梯五户,有,商品房,https://cs.lianjia.com/ershoufang/104108632256.html
和顺洋湖壹号 两梯两户 正规5房 诚心出售,此房是满五唯一可以省个税，户型周正，采光好，花园小区，,240,14118,5室2厅,低楼层,29,毛坯,南,2015,170,和顺洋湖壹号,洋湖垸,岳麓,两梯两户,有,商品房,https://cs.lianjia.com/ershoufang/104108640791.html
优质小4房，房东诚心出售，看房方便,地铁、城铁，小区中间位置，安静,93,9939,4室2厅,低楼层,11,精装,南 北,0,93.58,华银天际,万家丽南路,雨花,一梯三户,暂无数据,商品房,https://cs.lianjia.com/ershoufang/104108618478.html
华夏 竹韵商居 北桥新村 群芳园 地铁口,出行方便，拎包入住，正规三房，户型好，配套齐全,95,8011,3室2厅,中楼层,5,简装,东南,0,118.59,竹韵商居,伍家岭,开福,一梯两户,无,商品房,https://cs.lianjia.com/ershoufang/104108654689.html
卷烟厂 楼梯房 视野好 享受卷烟厂绿化 出行方便,这个房子证件在手 业主诚心卖 没有出租过，业主住星沙,40,5839,2室2厅,高楼层,7,精装,南 北,0,68.51,茶馆屋,雨花亭,雨花,一梯两户,无,商品房,https://cs.lianjia.com/ershoufang/104108445708.html
低于市价20个w 高层可看江景 户型通透 置换交易,虽然是刚需小户型，但是通透性很强，通风采光都是很nice。,162.8,17865,3室2厅,高楼层,45,毛坯,南,0,91.13,保利西海岸,银盆岭,岳麓,两梯四户,有,商品房,https://cs.lianjia.com/ershoufang/104107899405.html
南北通透小三房，不靠铁路，满五唯一，业主诚心出售,珠江郦城看河景小三房，保养好，业主诚心出售，视野好,115,12691,3室2厅,高楼层,18,精装,南 北,2015,90.62,珠江郦城薰衣道,福元西路,开福,两梯四户,有,商品房,https://cs.lianjia.com/ershoufang/104106707357.html
梅溪湖地铁2号线和6号线 毛坯价格买精装,梅溪湖地铁2号线和6号线 精装修房，楼层好,124.8,13731,3室2厅,高楼层,33,精装,南,2016,90.89,梅溪鑫苑名家,东方红,岳麓,两梯十三户,有,商品房,https://cs.lianjia.com/ershoufang/104108411249.html
恒大城 舒适三房 刚需改善精选,此房已满5年可正常交易 业主自住装修带家电,92,10085,3室2厅,高楼层,18,精装,北,0,91.23,长沙恒大城,万家丽南路,雨花,两梯四户,有,商品房,https://cs.lianjia.com/ershoufang/104106114025.html
滨江必看四房采光通风好，视野开阔，随时可以看房,户型方正，小区环境好，随时看房，交通方便,225,16508,4室2厅,高楼层,33,简装,东南,0,136.3,世茂铂翠湾,滨江新城,岳麓,两梯三户,有,商品房,https://cs.lianjia.com/ershoufang/104108110045.html
中间苑，居家装修三房，带车位，业主诚心出售,此房满五唯一，两证在手，居家装修，带车位，业主诚心出售,146,11701,3室2厅,低楼层,33,简装,南,2008,124.78,世纪城贯江苑,湘江世纪城,开福,两梯三户,有,商品房,https://cs.lianjia.com/ershoufang/104107523947.html
黄土岭双地铁口  单位电梯房  24小时热水,一号线四号线双地铁口 三房 高得房率 3房2卫,134.8,11573,3室2厅,中楼层,26,精装,南,0,116.48,黄土岭烟草宿舍,黄土岭,雨花,两梯六户,有,经济适用房,https://cs.lianjia.com/ershoufang/104108554452.html
洋湖板块精装两房 首付低 地铁口 不靠高速,终身免物业费 免费停车 有正规物业公司（一级物业）不靠高速,72.8,9471,2室1厅,低楼层,28,精装,南,0,76.87,洋湖和园,洋湖垸,岳麓,两梯四户,有,商品房,https://cs.lianjia.com/ershoufang/104108542022.html
中海国际社区三期 3室2厅 南,链家网真房源，更多房源信息请联系经纪人,123,10674,3室2厅,低楼层,33,精装,南,2013,115.24,中海国际社区三期,含浦,岳麓,两梯六户,有,商品房,https://cs.lianjia.com/ershoufang/104108122865.html
铁道学院 经典复式楼 上下两层 出行购方便 得房率高,LOFT复式楼。只算一层产证面积，中间楼层，拎包入住。,26,8467,1室1厅,中楼层,21,精装,南,2007,30.71,他城时代公寓,铁道学院,天心,五梯四十一户,有,商品房,https://cs.lianjia.com/ershoufang/104108585929.html
1号线友谊路站600米 周正小二居室 户口未用,此房满五年，1号线友谊路站600米 周正小二居室,63.8,9702,2室1厅,高楼层,16,简装,北,2008,65.76,满庭芳,铁道学院,天心,六梯二十四户,有,商品房,https://cs.lianjia.com/ershoufang/104108575770.html
此房很周正的户型，通透性好采光好，小区环境好,产证在手 此房很周正的户型，通透性好采光好，小区环境好,96,11022,2室2厅,低楼层,30,精装,南,2016,87.1,江山帝景雅典,含浦,岳麓,两梯四户,有,商品房,https://cs.lianjia.com/ershoufang/104108600404.html
丽发新城 2室2厅 东 南,链家网真房源，更多房源信息请联系经纪人,65,8013,2室2厅,中楼层,24,毛坯,东 南,0,81.12,丽发新城,跳马,雨花,两梯四户,有,商品房,https://cs.lianjia.com/ershoufang/104108614057.html
急售！！精装修，近地铁6号线，中间楼层，素质住户！,急售！！精装修，近地铁6号线，中间楼层，素质住户！,84.6,9637,2室2厅,中楼层,18,精装,北,2016,87.79,联美品格,河西人人乐,岳麓,两梯四户,有,商品房,https://cs.lianjia.com/ershoufang/104108627455.html
简装两居 朝南东边户 步梯房 中间位置 安静舒适,此房产证在手，当时是经济房，已转成商品房，看中可以随时交易。,58,7534,2室2厅,中楼层,6,简装,南,2005,76.99,湘樟家园,韶山南路,雨花,一梯五户,无,商品房,https://cs.lianjia.com/ershoufang/104108614623.html
钰龙天下 2室2厅 南 北,链家网真房源，更多房源信息请联系经纪人,195,24988,2室2厅,高楼层,33,毛坯,南 北,2016,78.04,钰龙天下,观沙岭,岳麓,两梯四户,有,商品房,https://cs.lianjia.com/ershoufang/104108621866.html
店长推荐，月亮岛精装两房，九成新,生活配套齐全，小区绿化好，环境佳，金碧物业,66.5,7591,2室1厅,低楼层,18,精装,南,0,87.61,恒大名都,金星北,望城,两梯四户,有,商品房,https://cs.lianjia.com/ershoufang/104108646559.html
房东诚心出售此房，满五唯一，随时看房，,正规两房 简单装修 .满五唯一。产权清晰，在手，随时过户，，,31.5,5366,2室1厅,中楼层,8,简装,南,1998,58.71,东风一村,烈士公园,开福,一梯四户,无,商品房,https://cs.lianjia.com/ershoufang/104108632236.html
正规一室一厅，带燃气，精装拎包入住，双地铁口,朝小区里面，没有噪音影响，带燃气正规一室一厅,42,10615,1室1厅,低楼层,32,其他,南,2011,39.57,藏珑湖上国际花园,广电,开福,四梯二十四户,有,商品房,https://cs.lianjia.com/ershoufang/104108595491.html
雨花区政府喜盈门中南家园全新精装两房 南北通透 2楼,中南院单位房，公摊小得房率高，通风采光好,54.8,8720,2室2厅,中楼层,5,精装,南 北,1984,62.85,中南家园,武广新城,雨花,一梯两户,暂无数据,商品房,https://cs.lianjia.com/ershoufang/104108597970.html
6号线地铁口 梅溪鑫苑名家精装两房 岳麓实小、西雅旁,梅溪湖周正两房，得房率高、业主住家装修，现代简约风格。,110,15278,2室2厅,中楼层,33,精装,南,0,72,梅溪鑫苑名家,东方红,岳麓,两梯四户,有,商品房,https://cs.lianjia.com/ershoufang/104108628336.html
双地铁、繁华商圈、高楼层，采光好,双地铁、繁华商圈、高楼层，采光好，没有任何遮挡,129.8,10445,3室2厅,高楼层,33,简装,南 北,0,124.27,麓江春,桐梓坡,岳麓,两梯六户,有,商品房,https://cs.lianjia.com/ershoufang/104108612822.html
开元路地铁口，房东新铺的实木地板,中间楼层，居家装修，看房方便，拎包入住,55.8,7006,2室2厅,中楼层,17,精装,南,0,79.65,彩都,开元路,长沙县,两梯五户,有,商品房,https://cs.lianjia.com/ershoufang/104108640094.html
6号线地铁口 梅溪鑫苑名家精装两房 岳麓实小、西雅旁,梅溪湖周正两房，得房率高、业主住家装修，现代简约风格。,110,15278,2室2厅,中楼层,33,精装,南,0,72,梅溪鑫苑名家,东方红,岳麓,两梯四户,有,商品房,https://cs.lianjia.com/ershoufang/104108628336.html
五矿万境和苑 两房急售 带简装,此房满五唯一 可减免个人所得税两个点,122.8,14135,2室2厅,中楼层,33,简装,南 东南,2015,86.88,五矿万境水岸二期,喜盈门,雨花,两梯四户,有,商品房,https://cs.lianjia.com/ershoufang/104108591755.html
买好房 搞定丈母娘！惊现8字头温馨两房 地铁口,房东诚售 成熟商圈电梯房仅8字头拎包入住 交通方便 东边户,59.8,8484,2室1厅,高楼层,22,精装,东 南,2011,70.49,西子一间,高桥,雨花,六梯十七户,有,商品房,https://cs.lianjia.com/ershoufang/104108626784.html
闹中取静，2环边上，远离喧嚣。颐养人生。,树木岭 龙吉湾 2008年电梯两房 居家装修 地段好，环境安静。,64.5,7716,2室2厅,低楼层,11,精装,南,2008,83.6,龙吉湾小区,树木岭,雨花,一梯两户,有,商品房,https://cs.lianjia.com/ershoufang/104108648827.html
双地铁、繁华商圈、高楼层，采光好,双地铁、繁华商圈、高楼层，采光好，没有任何遮挡,129.8,10445,3室2厅,高楼层,33,简装,南 北,0,124.27,麓江春,桐梓坡,岳麓,两梯六户,有,商品房,https://cs.lianjia.com/ershoufang/104108612822.html
地铁口，步步高商场，拎包入住两房，业主急卖,此房满五唯一，格局好，中高楼层，视野采光好,72,8833,2室2厅,中楼层,21,精装,南 北,2013,81.52,丽发新城,跳马,雨花,两梯四户,有,商品房,https://cs.lianjia.com/ershoufang/104108656728.html
书院路精装修02年房子，楼层好，出行方便，随时看房,此房属于书院路，近湘江风光带，近碧沙湖地铁，自住精装三房,66.6,9389,2室2厅,中楼层,7,精装,南 北,0,70.94,杏花园,书院路,天心,一梯两户,暂无数据,商品房,https://cs.lianjia.com/ershoufang/104108602982.html
