标题,卖点,总价,单价,户型,楼层,共有楼层数,装修,朝向,建造时间,面积,小区,区域,所属区,梯户比例,是否有电梯,房屋属性,详情页
华润凤凰城，精装三房，业主诚心出售,配套齐全完善 生活便捷 资源丰富 视野开阔 户型周正,83.8,9546,3室1厅,低楼层,18,精装,南 北,2010,87.79,华润凤凰城,开元路,长沙县,两梯四户,有,商品房,https://cs.lianjia.com/ershoufang/104108628446.html
嘉明苑 2室1厅 南,链家网真房源，更多房源信息请联系经纪人,67,9132,2室1厅,中楼层,7,精装,南,2002,73.37,嘉明苑,河西步步高,岳麓,一梯两户,无,商品房,https://cs.lianjia.com/ershoufang/104108654122.html
满五唯一，地铁精装2房，急售！,此房源，满五唯一，视野开阔，采光好，房子保养好，没怎么住过。,72.8,9506,2室2厅,高楼层,27,其他,南,2014,76.59,保利香槟国际,万家丽北,长沙县,两梯四户,有,商品房,https://cs.lianjia.com/ershoufang/104108567443.html
德思勤喜临门商圈精装小三房业主诚心出售,此房满五唯一，楼盘新，楼层好，九成新，有地暖,110,12163,3室2厅,低楼层,32,精装,南,2016,90.44,南城印象,喜盈门,雨花,两梯四户,有,商品房,https://cs.lianjia.com/ershoufang/104108624423.html
满五唯一 自住精致装修 证在手 诚心出售,满五唯一 自住精致装修 证在手 诚心出售 南北 通向,133.5,12500,3室2厅,中楼层,30,精装,南,2016,106.8,江山帝景雅典,含浦,岳麓,两梯四户,有,商品房,https://cs.lianjia.com/ershoufang/104108612262.html
万达广场 乐和城商圈 全线江景壕宅 阳台即可欣赏美景,房子江景视野很好，无任何遮挡，是湘江一桥到二桥之间江景视野,312,19452,3室2厅,中楼层,47,精装,西北,0,160.4,潮宗御苑,松桂园,开福,三梯四户,有,商品房,https://cs.lianjia.com/ershoufang/104108566177.html
此房户型周正，南北通透，带一个10平方的花园。,此房户型周正，南北通透，居家装修，带一个10平方左右的花园,106,9455,3室1厅,低楼层,11,精装,南 北,2007,112.11,珠江花城一期,福元西路,开福,两梯三户,有,商品房,https://cs.lianjia.com/ershoufang/104108583375.html
树木岭正规三房，业主诚心出售，户型周正,视野开阔 采光充足 配套设施齐全 交通便利,108,11800,3室2厅,高楼层,18,精装,南,2013,91.53,新城新世界一期,高桥,雨花,两梯四户,有,商品房,https://cs.lianjia.com/ershoufang/104108644201.html
陶瓷城E区 三房两厅 翻新装修 配套完善 南北通透,南北通透，楼层三楼，采光好，客厅带窗，东边户,108,8481,3室2厅,中楼层,5,其他,南 北,0,127.35,马王堆陶瓷建材新城,马王堆,芙蓉,一梯两户,无,商品房,https://cs.lianjia.com/ershoufang/104108617228.html
地铁口 8层电梯洋房 万家丽北山水湾 诚心出售 随时看,地铁口 8层电梯洋房 万家丽北山水湾 诚心出售 随时看,112.5,8844,3室2厅,低楼层,8,精装,南 北,2012,127.21,山水湾,万家丽北,长沙县,一梯两户,无,商品房,https://cs.lianjia.com/ershoufang/104108590429.html
满五唯一，自住精装修，业主诚心卖,此房满五唯一，自住精装修，业主诚心卖。,102,11260,3室2厅,低楼层,18,精装,南 北,2015,90.59,珠江郦城薰衣道,福元西路,开福,两梯四户,有,商品房,https://cs.lianjia.com/ershoufang/104108632010.html
保利精装3房 出门就是幼小 品质楼盘 拎包入住,户型好，采光充足户 ，小区环境好 安静 低密度,112,11657,3室2厅,低楼层,34,精装,南 北,0,96.08,中航城,万家丽南路,雨花,三梯六户,有,商品房,https://cs.lianjia.com/ershoufang/104108621431.html
省植物园旁 满五唯一 拎包入住三房 诚心出售,户型好，采光充足户 ，小区环境好 安静,85,10531,3室2厅,中楼层,34,精装,东南,0,80.72,中航城,万家丽南路,雨花,三梯六户,有,商品房,https://cs.lianjia.com/ershoufang/104108629707.html
泊爱蓝湾，精装三房，拎包入住，中间楼层，看房方便,泊爱蓝湾，枫树山美联，精装三房，拎包入住，中间楼层，看房方便,140,12116,3室2厅,中楼层,33,精装,南,2013,115.55,泊爱蓝湾,尚东,雨花,两梯四户,有,商品房,https://cs.lianjia.com/ershoufang/104108599093.html
此房满五唯一，业主诚心出售，楼层好，采光好,此房满五唯一，楼层好，采光好，业主诚心出售,90,9954,3室2厅,高楼层,18,简装,东,0,90.42,五矿紫湖香醍,暮云,天心,一梯三户,暂无数据,商品房,https://cs.lianjia.com/ershoufang/104108636128.html
满五唯一 正规3房 中间楼层 可拎包入住 房东诚心出售,此房满五唯一 免个税，正规3房 全明户型  中层楼。,58.8,7667,3室1厅,中楼层,6,精装,南,1997,76.7,赤岗社区,左家塘,雨花,一梯两户,无,商品房,https://cs.lianjia.com/ershoufang/104108645114.html
雨花亭二环内，地铁口，闹中取静，户型周正，拎包入住,户型周正，采光好，位置地段好，交通配套齐全,94,10467,4室1厅,低楼层,9,精装,南,2008,89.81,山水花都,雨花亭,雨花,两梯三户,有,商品房,https://cs.lianjia.com/ershoufang/104108577585.html
世景华庭精装三房 位置好 中间楼层 户型周正,房子南北 通透 业主诚心出售 中间楼层,99.8,7943,3室2厅,高楼层,18,精装,南 北,0,125.66,世景华庭,万家丽北,长沙县,两梯两户,有,商品房,https://cs.lianjia.com/ershoufang/104108628579.html
带地暖三房满五唯一，户型南北通透,带地暖三房满五唯一，户型南北通透,122.8,12992,3室2厅,高楼层,34,精装,南 北,2012,94.52,万国城三期,福元西路,开福,两梯四户,有,商品房,https://cs.lianjia.com/ershoufang/104108621551.html
沙湾公园 精装四房带地暖 南北通透 业主自住 诚心出售,精装修带地暖家电家具，中间楼层，户型周正，带三阳台，,148,9118,4室2厅,低楼层,29,精装,南 北,0,162.33,白沙湾嘉园,武广新城,雨花,两梯三户,有,商品房,https://cs.lianjia.com/ershoufang/104108593579.html
万科物业 三房两卫 带入户花园 无抵押,万科物业 三房两卫 带入户花园 无抵押,108,12018,3室2厅,低楼层,24,其他,南 北,0,89.87,万科城市花园,梅溪湖北岸,岳麓,两梯六户,有,商品房,https://cs.lianjia.com/ershoufang/104108627954.html
此房满五唯一 可免2%个税 采光好 户型通透 湖景房,此房满五唯一 可免2%个税 采光好 户型通透 湖景房,112,9573,3室2厅,低楼层,35,其他,南,2015,117,时代倾城,金星北,望城,两梯八户,有,商品房,https://cs.lianjia.com/ershoufang/104108611220.html
9成新南北对流精装3房，业主诚心出售,南北，楼层好，视野宽阔，采光充,66,7595,3室2厅,高楼层,34,精装,南 北,0,86.9,佳兆业水岸新都东区,跳马,雨花,两梯四户,有,商品房,https://cs.lianjia.com/ershoufang/104108627843.html
金星北 次新小区 刚需小三房 全实木家具拎包入住,金星北品质小区，房东自住装修，纯纯拎包入住！,95,10739,3室2厅,低楼层,33,精装,南,2016,88.47,润和之悦,金星北,望城,两梯四户,有,商品房,https://cs.lianjia.com/ershoufang/104108628720.html
万科物业 三房两卫 带入户花园 无抵押,万科物业 三房两卫 带入户花园 无抵押,108,12018,3室2厅,低楼层,24,其他,南 北,0,89.87,万科城市花园,梅溪湖北岸,岳麓,两梯六户,有,商品房,https://cs.lianjia.com/ershoufang/104108627954.html
业主诚售 康桥精装四房  满五唯一 视野采光好,此房业主急售 居家精装修 满五唯一 可读湘郡 南北格局,104,8071,4室2厅,低楼层,33,精装,南,2010,128.86,未来康桥长郡,泉塘,长沙县,两梯三户,有,商品房,https://cs.lianjia.com/ershoufang/104108643622.html
方略潇邦 2室2厅 南,链家网真房源，更多房源信息请联系经纪人,62.8,6943,2室2厅,低楼层,33,精装,南,2010,90.46,方略潇邦,泉塘,长沙县,两梯六户,有,商品房,https://cs.lianjia.com/ershoufang/104108615016.html
梅溪鑫苑名家  西雅 设计师作品 地铁口,满五唯一 ，同户型比别人家空间感大了很多,138.8,15346,3室2厅,低楼层,33,其他,南 北,2017,90.45,梅溪鑫苑名家,东方红,岳麓,三梯四户,有,商品房,https://cs.lianjia.com/ershoufang/104108614259.html
湘麓国际 6号线地铁 高新区管委会 麓谷公园 精装三房,麓谷公园精装三房.可以在家看麓谷公园，朝南户型，业主诚意出售,151.8,11477,3室2厅,高楼层,18,其他,南,2007,132.27,湘麓国际,麓谷东,岳麓,两梯三户,有,商品房,https://cs.lianjia.com/ershoufang/104108631336.html
品质小区  配套成熟  莱茵城精装三房,"楼层佳，采光无遮挡，视野好,精装无瑕疵，拎包入住。",103,10213,3室2厅,中楼层,25,精装,北,2010,100.86,宜居莱茵城,河西人人乐,岳麓,两梯四户,有,商品房,https://cs.lianjia.com/ershoufang/104108590203.html
此房满五唯一，户型周正，精装修带全套家具家电.,此房满五唯一，户型周正，楼层好，采光好，精装修带全套家具家电,85.6,9407,3室2厅,低楼层,34,精装,南,2013,91,CROSS尚公馆,金星北,望城,两梯五户,有,商品房,https://cs.lianjia.com/ershoufang/104108652707.html
满五唯一，沃尔玛旁，户型周正，业主诚心卖,高层采光视野佳，采光充足，配套齐全，交通便利。,79.8,9510,3室1厅,高楼层,33,简装,南,2015,83.92,洋湖style,含浦,岳麓,两梯三户,有,商品房,https://cs.lianjia.com/ershoufang/104108593363.html
长房西郡，居家三房两厅两卫，双阳台房东诚心出售,此房户型格局好，自住装修，有车位，交通便利,126,9464,3室2厅,高楼层,11,精装,南 北,2010,133.14,长房西郡,河西人人乐,岳麓,一梯两户,有,商品房,https://cs.lianjia.com/ershoufang/104108618129.html
价格可聊，户型周正，装修保养较好。,小区物业好，24小时有保安，小区有公共健身设施，绿化好，环..,74.8,8044,3室1厅,中楼层,25,精装,南 北,0,93,三景国际,泉塘,长沙县,两梯四户,有,商品房,https://cs.lianjia.com/ershoufang/104108656129.html
央企品质 花园式小区 自住标准刚需小三房 看房方便,央企品质花园式小高层 交通便利 配套成熟,122,13017,3室2厅,高楼层,17,精装,南,0,93.73,中建芙蓉嘉苑,省政府,天心,两梯四户,有,商品房,https://cs.lianjia.com/ershoufang/104108600525.html
湘雅附二  育才 1楼  正规2房带院子 交通便利,户型周正，楼层好，视野宽阔，采光充足，配套齐全，交通便利。,52,9365,2室1厅,低楼层,6,简装,南,0,55.53,育才宿舍,浏城桥,芙蓉,一梯两户,暂无数据,商品房,https://cs.lianjia.com/ershoufang/104108654149.html
恒大华府二期一梯一户大三房透精装全套适合陪读,恒大精装三房，视野宽阔可远眺岳麓山，近麓山陪读方便!,278,20724,3室2厅,高楼层,18,精装,东南,2010,134.15,恒大华府,市政府,岳麓,两梯四户,有,商品房,https://cs.lianjia.com/ershoufang/104108578818.html
洋湖湿地公园旁 满五唯一 全明三房！,此房居家装修 保养好房屋整洁 格局通透采光好,107,11002,3室2厅,高楼层,26,精装,南,0,97.26,江山帝景哈佛,含浦,岳麓,两梯四户,有,商品房,https://cs.lianjia.com/ershoufang/104108597805.html
汽车西站 品格家园 满五唯一 带阁楼  业主自住装修,满五唯一 南北通透  带阁楼 业主诚心出售,65,7826,3室2厅,高楼层,6,精装,南 北,2006,83.06,品格家园,汽车西站,岳麓,一梯两户,无,商品房,https://cs.lianjia.com/ershoufang/104108603571.html
烈士公园   地铁口  一楼带院子   两室两厅,房子就是在烈士公园北门里面，公园环境，出行都是不错的,73.8,9318,2室2厅,低楼层,7,简装,南,0,79.21,湖南烈士公园宿舍,烈士公园,开福,一梯两户,暂无数据,商品房,https://cs.lianjia.com/ershoufang/104108619471.html
大阳台 正南朝向 一线浏阳河视野 全套美式家具,万科城精装小三房，满五不唯一，家具家电齐全，楼层视野好诚心..,128.8,14052,3室2厅,高楼层,34,其他,南,2014,91.66,万科城二期B区,福元西路,开福,两梯四户,有,商品房,https://cs.lianjia.com/ershoufang/104108635833.html
长郡旁，2号线地铁，业主自住精装，边户户型...,长郡旁，2号线地铁，业主自住精装，边户小三房通透户型...,185.8,20168,3室2厅,低楼层,34,精装,东南 南,2014,92.13,合能璞丽,梅溪湖北岸,岳麓,两梯四户,有,商品房,https://cs.lianjia.com/ershoufang/104108619847.html
配套设施齐全。交通方便，采光好,精装修，可以直接拎包入住，配套设施齐全，公园旁，房东急售,168,12013,4室2厅,高楼层,20,简装,东南,2011,139.85,景秀江山,银盆岭,岳麓,两梯七户,有,商品房,https://cs.lianjia.com/ershoufang/104108613563.html
业主精装自住，户型舒适，诚心急卖,此房户型南北对流，采光好，通风好，自住精装，拎包入住。,145,10686,5室2厅,高楼层,33,精装,南,2013,135.7,润和紫郡,金星北,望城,两梯四户,有,商品房,https://cs.lianjia.com/ershoufang/104108659091.html
小区集洋房、别墅高层于一体配套齐全整个小区占地面积,小区集洋房、别墅、高层于一体，配套齐全，整个小区占地面积..,125,9115,3室2厅,中楼层,6,精装,南,0,137.14,南山苏迪亚诺,金星北,望城,一梯两户,无,商品房,https://cs.lianjia.com/ershoufang/104108602165.html
怡海星城。此房不错，小区生活配套齐全,怡海星城。此房不错，小区生活配套齐全,87,8655,3室2厅,中楼层,16,精装,南,2016,100.53,怡海星城,暮云,天心,两梯四户,有,商品房,https://cs.lianjia.com/ershoufang/104108622046.html
小区中间楼栋，高层视野开阔，采光好，正南正北,楼层好  保养好 采光充足 视线开阔 配套设施齐全 交通便利,120,13353,3室2厅,高楼层,34,精装,南,2014,89.87,万科城三期,福元西路,开福,两梯四户,有,商品房,https://cs.lianjia.com/ershoufang/104108634798.html
正地铁口 松雅湖 吾悦天虹商场旁精装三房拎包入住,三号线地铁口，交通便利，精装修,82.8,9281,3室2厅,低楼层,33,简装,南,2015,89.22,方略城市广场,开元路,长沙县,两梯两户,有,商品房,https://cs.lianjia.com/ershoufang/104108612258.html
优质好房诚心出售，看房方便。。,房子在二楼 ，没什么装备 整个中南醉便 一的一套,47.6,4176,3室2厅,低楼层,6,简装,南,2004,114.01,中南汽车世界,中南汽车世界,长沙县,一梯两户,暂无数据,商品房,https://cs.lianjia.com/ershoufang/104108623771.html
德思勤七号线地铁口，品质小区。,小区2016年重新改造 环境好 德思勤800米什么都方便,76,7741,3室2厅,中楼层,5,简装,南,0,98.19,高升家园A区,德思勤,雨花,一梯两户,无,商品房,https://cs.lianjia.com/ershoufang/104108653026.html
急售 天园假日紫御江山长郡东雅拎包入住 满五唯一,满五唯一，居家精装，中楼层采光通风好，成色新，拎包入住！,97.8,10838,3室2厅,中楼层,16,精装,东南,2012,90.24,天园假日,汽车东站,芙蓉,两梯四户,有,商品房,https://cs.lianjia.com/ershoufang/104108593961.html
精装小三房  业主居住很少 可拎包入住,户型比较通透 业主住的也比较少 保养得很好 基本就可以入住,112,12828,3室2厅,低楼层,32,精装,东南,2014,87.31,香樟兰亭,树木岭,雨花,两梯三户,有,商品房,https://cs.lianjia.com/ershoufang/104108654490.html
高鑫麓城 3室2厅 南,链家网真房源，更多房源信息请联系经纪人,178,13502,3室2厅,中楼层,18,精装,南,2012,131.84,高鑫麓城,商学院,岳麓,两梯两户,有,商品房,https://cs.lianjia.com/ershoufang/104108641938.html
三号正地铁口 开元西路 筑梦园 纯板楼 房东诚心出售,开元路主干道，三号线湘龙站正地铁口。小区环境好，中间楼栋,104.8,7963,3室1厅,高楼层,18,精装,南,2006,131.61,筑梦园,中南汽车世界,长沙县,两梯两户,有,商品房,https://cs.lianjia.com/ershoufang/104108657140.html
圭塘河风光带旁 紧凑型四房 业主诚心出售,售房预算低 可以买四房  交通地铁商场 一应俱全,116,12832,4室2厅,中楼层,32,简装,南,2014,90.4,香樟兰亭,树木岭,雨花,两梯四户,有,商品房,https://cs.lianjia.com/ershoufang/104108614148.html
央企保利，高品质楼盘，强烈推荐，必看好房,此房满五唯一，楼层好，户型周正，采光充足，配套设施齐全,86.8,9722,3室2厅,高楼层,27,精装,南,2014,89.29,保利香槟国际,万家丽北,长沙县,两梯四户,有,商品房,https://cs.lianjia.com/ershoufang/104108620594.html
万科城三房两卫、独门独户带杂物间 业主诚心,万科城二期带储物间san房，视野开阔无遮挡，业主诚心,128,14202,3室2厅,低楼层,34,其他,南,2014,90.13,万科城二期B区,福元西路,开福,两梯五户,有,商品房,https://cs.lianjia.com/ershoufang/104108606093.html
满五唯一，户型好楼层好 采光好房东急售 二房改三房,满五唯一，户型好楼层好 采光好房东急售 二房改三房,55,7209,2室2厅,高楼层,18,简装,南,0,76.3,丽都桃源,河西人人乐,岳麓,五梯十户,有,商品房,https://cs.lianjia.com/ershoufang/104108624026.html
德思勤七号线地铁口，品质小区。,小区2016年重新改造 环境好 德思勤800米什么都方便,76,7741,3室2厅,中楼层,5,简装,南,0,98.19,高升家园A区,德思勤,雨花,一梯两户,无,商品房,https://cs.lianjia.com/ershoufang/104108653026.html
南庭城果   急售毛坯小三房   业主诚心出售,"心卖点：
离比亚迪近，交通便利 房屋格局好 ，精装修 拎包入.住",72.8,8625,3室2厅,低楼层,33,精装,南,2013,84.41,南庭城果,跳马,雨花,一梯三户,暂无数据,商品房,https://cs.lianjia.com/ershoufang/104108623545.html
置换房源，精装拎包入住，采光好,采光充足，交通便利，精装修，保养好，拎包入住,105,11524,3室2厅,中楼层,26,精装,南,2018,91.12,盛世耀凯,河西人人乐,岳麓,两梯四户,有,商品房,https://cs.lianjia.com/ershoufang/104108614755.html
小区中间楼栋，高层视野开阔，采光好，正南正北,楼层好  保养好 采光充足 视线开阔 配套设施齐全 交通便利,120,13353,3室2厅,高楼层,34,精装,南,2014,89.87,万科城三期,福元西路,开福,两梯四户,有,商品房,https://cs.lianjia.com/ershoufang/104108634798.html
精装4房，南北通透，中间楼层，采光好,精装4房，南北通透，中间楼层，采光好,135.6,11435,4室2厅,低楼层,31,精装,南 北,2014,118.59,潇湘奥林匹克花园,麓谷西,岳麓,两梯四户,有,商品房,https://cs.lianjia.com/ershoufang/104108599402.html
精装小三房  业主居住很少 可拎包入住,户型比较通透 业主住的也比较少 保养得很好 基本就可以入住,112,12828,3室2厅,低楼层,32,精装,东南,2014,87.31,香樟兰亭,树木岭,雨花,两梯三户,有,商品房,https://cs.lianjia.com/ershoufang/104108654490.html
魅力之城 精装修 视野无遮挡 浏阳河景观,此房满五唯一，精装修、轻奢风格，视野很好，自住保养很好,132,13243,3室2厅,中楼层,34,精装,南,2014,99.68,万科魅力之城,武广新城,雨花,两梯十三户,有,商品房,https://cs.lianjia.com/ershoufang/104108584955.html
西子湖畔 3室2厅 南 北,链家网真房源，更多房源信息请联系经纪人,120,12267,3室2厅,中楼层,11,其他,南 北,2011,97.83,西子湖畔,金星中路,岳麓,两梯两户,有,商品房,https://cs.lianjia.com/ershoufang/104108600143.html
南北通，格局好  诚心出售，成熟配套 有加.建,南北通，格局好 视野采光好 诚心出售，成熟配套 有加.建,60,8111,3室2厅,低楼层,19,简装,南 北,2009,73.98,湘林小区,铁道学院,天心,一梯两户,有,经济适用房,https://cs.lianjia.com/ershoufang/104108632736.html
急售 满五唯一  带砂子塘 4号线地铁 电梯3房,急售 满五唯一  带砂子塘 4号线地铁 电梯3房,168,14112,3室1厅,中楼层,17,精装,南 北,2006,119.05,新锐湘都,雨花亭,雨花,两梯八户,有,商品房,https://cs.lianjia.com/ershoufang/104108622600.html
月亮岛地铁口精装大5房满五唯一诚心出售,业主自己装修，采光好，小区很适合居住，户型好，套内面积大,127.5,11177,5室2厅,中楼层,33,精装,南,0,114.08,勤诚达新界,金星北,望城,两梯四户,有,商品房,https://cs.lianjia.com/ershoufang/104108659207.html
融科三万英尺 大四房精装修看房方便 产权证在手无抵押,融科三万英尺 大四房 精装修 看房方便 产权证在手无抵押,305,15375,4室2厅,低楼层,31,精装,南 北,2006,198.38,融科三万英尺,雨花亭,雨花,两梯两户,有,商品房,https://cs.lianjia.com/ershoufang/104108636549.html
户型周正  居家装修  通风好  拎包入住,视野宽阔  采光充足  配套设施齐全  交通便利,129.8,10742,3室2厅,低楼层,34,精装,东南,2013,120.84,海洋半岛,广电,开福,两梯四户,有,商品房,https://cs.lianjia.com/ershoufang/104108633282.html
满五唯一，南北通透自住精装修，中间楼层,满五唯一，南北通透自住精装修，中间楼层,115,12828,3室2厅,中楼层,30,精装,南 北,2012,89.65,万国城三期,福元西路,开福,两梯四户,有,商品房,https://cs.lianjia.com/ershoufang/104108628245.html
北辰三角洲奥城E4区 居家精装修3+1户型 满五唯一,北辰3+1户型，满五唯一，阳台朝南，视野采光好，随时方便看房,248.8,18276,3室2厅,低楼层,45,精装,南,0,136.14,北辰三角洲奥城E4区,北辰三角洲,开福,两梯四户,有,商品房,https://cs.lianjia.com/ershoufang/104108647067.html
月亮岛绿城物业 自主精装 满五唯一 中间楼层 诚心出售,月亮岛绿城物业 自主精装 满五唯一 中间楼层 诚心出售,128,10519,4室2厅,中楼层,32,其他,南 北,0,121.69,乾源国际广场,金星北,望城,两梯四户,有,商品房,https://cs.lianjia.com/ershoufang/104108606947.html
蓝光COCO蜜城 4室2厅 南,链家网真房源，更多房源信息请联系经纪人,249,18143,4室2厅,高楼层,31,精装,南,2015,137.25,蓝光COCO蜜城,洋湖垸,岳麓,两梯四户,有,商品房,https://cs.lianjia.com/ershoufang/104108637115.html
双地铁口 园林小区 五代同堂 南北对流,户型好，双地铁口3号线 业主诚心卖,275,11522,8室2厅,高楼层,14,精装,南,2003,238.68,亚华香舍花都,东塘,雨花,一梯三户,有,商品房,https://cs.lianjia.com/ershoufang/104108070279.html
北辰精品房源，视野好，业主诚心出售，下楼就是地铁口,北辰精品大户型，视野好，满五唯一，业主诚心出售，下楼就是..,245,17884,4室2厅,中楼层,38,其他,南 北,2013,137,北辰三角洲奥城E3区,北辰三角洲,开福,两梯四户,有,商品房,https://cs.lianjia.com/ershoufang/104105949747.html
万科金域缇香 4室2厅 南,链家网真房源，更多房源信息请联系经纪人,315,18931,4室2厅,中楼层,22,其他,南,2013,166.4,万科金域缇香,阳光100,岳麓,两梯三户,有,商品房,https://cs.lianjia.com/ershoufang/104108217587.html
市政府西城龙庭 精装四房+三阳台 拎包入住，随时看房,光视野好，两梯四户，朝南户型，装修才三年多，可拎包入住,168,12480,4室2厅,高楼层,28,精装,南,2011,134.62,西城龙庭,河西步步高,岳麓,两梯四户,有,商品房,https://cs.lianjia.com/ershoufang/104108093037.html
"广电(一楼洋房带200平私人院子)鸟语花香,天然氧吧","房子带200平米私人花园, 花园经过精心设计的.花了不少钱",165,12613,3室2厅,低楼层,11,精装,南,0,130.82,金鹰城圣爵菲斯,中南汽车世界,开福,一梯两户,暂无数据,商品房,https://cs.lianjia.com/ershoufang/104106304861.html
湘江边4房复式楼，带30平露台，少有跃式3层户型诚售,带电梯三层跃式楼，户型实用，带露台，厅大单价低，诚售.,188,10837,4室2厅,高楼层,7,精装,南,2005,173.49,航空母舰小区,溁湾镇,岳麓,一梯四户,有,商品房,https://cs.lianjia.com/ershoufang/104107768900.html
"格局相当漂亮， 位置独特，视野开阔,满四唯一",小区24小时保安巡逻，小区绿化好，自带健身休闲体，视野好通..,229,13487,7室3厅,低楼层,2,精装,南,0,169.8,勤诚达新界,金星北,望城,一梯一户,暂无数据,商品房,https://cs.lianjia.com/ershoufang/104107955643.html
西站麓谷板块 精装通透三房  成熟小区,此房户型好，交通便利，业主诚心出售，看房提前预约,118,9606,3室2厅,中楼层,17,精装,南,2005,122.85,麓谷e家人,麓谷东,岳麓,一梯两户,有,商品房,https://cs.lianjia.com/ershoufang/104106646302.html
"格局相当漂亮， 位置独特，视野开阔,满四唯一",小区24小时保安巡逻，小区绿化好，自带健身休闲体，视野好通..,229,13487,7室3厅,低楼层,2,精装,南,0,169.8,勤诚达新界,金星北,望城,一梯一户,暂无数据,商品房,https://cs.lianjia.com/ershoufang/104107955643.html
市政府旁  步步高商圈 装修好 户型周正 大三房、,市政府板块周正大三房 地铁6号线，采光好，选大三房,149.8,11708,3室2厅,中楼层,28,精装,东南 东北,2008,127.95,金麓国际商务广场,河西步步高,岳麓,两梯四户,有,商品房,https://cs.lianjia.com/ershoufang/104108395374.html
